{
  "version": "completion-record-v1",
  "id": "COMP-20260311-104940-8073",
  "ts_iso": "2026-03-11T10:49:40.601971+00:00",
  "actor": "logron",
  "summary": "Cycle 37 postprocess completed: 3 specs, 0/9 backtests complete, passes 0, promotions 0.",
  "outcome": "partial",
  "significance": "medium",
  "tasks_completed": [
    "TASK-0004"
  ],
  "files_touched": [
    "data/state/current_cycle_metrics.json",
    "data/state/current_cycle_batch_summary.json",
    "agents/quandalf/memory/current_cycle_status.json"
  ],
  "evidence": [
    "data/state/current_cycle_metrics.json",
    "data/state/current_cycle_batch_summary.json"
  ],
  "follow_up_titles": [],
  "notes": "best_qscore=0.0; lessons_added=0; terminal_failures=0",
  "memory_candidates": []
}