{
  "version": "completion-record-v1",
  "id": "COMP-20260310-114629-F6FF",
  "ts_iso": "2026-03-10T11:46:29.570484+00:00",
  "actor": "oragorn",
  "summary": "Added recurring promotion/backfill automation for shared memory across Quandalf, Frodex, and Logron by wiring promotion scripts into daily maintenance.",
  "outcome": "success",
  "significance": "high",
  "tasks_completed": [
    "TASK-0011"
  ],
  "files_touched": [
    "pipelines/daily-maintenance.lobster",
    "docs/SHARED_MEMORY_AUTOMATION.md"
  ],
  "evidence": [
    "pipelines/daily-maintenance.lobster",
    "docs/SHARED_MEMORY_AUTOMATION.md"
  ],
  "follow_up_titles": [
    "Add recurring validation/audit checks for memory governance health"
  ],
  "notes": "Shared memory promotion is now part of recurring maintenance, not a manual step.",
  "memory_candidates": []
}