{
  "version": "completion-record-v1",
  "id": "COMP-20260310-095601-6F57",
  "ts_iso": "2026-03-10T09:56:01.070996+00:00",
  "actor": "oragorn",
  "summary": "Bootstrapped the memory governance spine with config, schemas, roadmap, task board, completion records, and automation scripts.",
  "outcome": "success",
  "significance": "high",
  "tasks_completed": [
    "TASK-0001"
  ],
  "files_touched": [
    "config/memory-governance.json",
    "schemas/task-board.schema.json",
    "schemas/completion-record.schema.json",
    "ROADMAP.md",
    "docs/MEMORY_GOVERNANCE_V2.md",
    "scripts/task_governor.py",
    "scripts/memory_governor.py",
    "data/state/task_board.json"
  ],
  "evidence": [
    "ROADMAP.md",
    "data/state/task_board.json"
  ],
  "follow_up_titles": [],
  "notes": "Initial governance layer is live and self-updating.",
  "memory_candidates": []
}