{
  "version": "completion-record-v1",
  "id": "COMP-20260310-115252-8C8C",
  "ts_iso": "2026-03-10T11:52:52.946055+00:00",
  "actor": "oragorn",
  "summary": "Added a memory-governance status summary view and broader agent retrieval/known-fix config scaffolding for quick operator health checks.",
  "outcome": "success",
  "significance": "high",
  "tasks_completed": [
    "TASK-0014"
  ],
  "files_touched": [
    "scripts/memory_governance_status.py",
    "data/state/memory_governance_status.json",
    "config/frodex-briefing.json",
    "config/logron-briefing.json",
    "config/known-fixes-registry.json"
  ],
  "evidence": [
    "data/state/memory_governance_status.json"
  ],
  "follow_up_titles": [
    "Implement richer live external feed ingestion and relevance scoring"
  ],
  "notes": "Status summary now exposes task progress, shared-memory size, audit status, compaction status, and enabled external sources.",
  "memory_candidates": []
}